{"$schema":"https://json-schema.org/draft/2020-12/schema","type":"object","additionalProperties":false,"required":["schema_version","order_id","hypothesis_id","mode","outcome","evidence_tier","edge_claim","real_provisioning_consumed","dataset_reference","expected_dataset_sha256","dataset_artifact","contract_artifacts","activation_provenance","access_counters","validation_seal","producing_git_commit"],"properties":{"schema_version":{"const":"lily_l4_b86r11_provisioning_report_v13"},"order_id":{"const":"B8.6R11"},"hypothesis_id":{"const":"L-4"},"mode":{"enum":["synthetic_fixture","real_one_shot"]},"outcome":{"enum":["provisioning_blocked","structural_provisioned"]},"evidence_tier":{"const":"E0"},"edge_claim":{"const":"none"},"real_provisioning_consumed":{"type":"boolean"},"dataset_reference":{"const":"data/normalized/l1_yahoo_daily_v1.json"},"expected_dataset_sha256":{"const":"6608c0ef88f4b7edaef7523738d7a172215aa4f97c8c403adeba884d6582a4dd"},"dataset_artifact":{"type":"object"},"contract_artifacts":{"type":"object"},"activation_provenance":{"type":["object","null"]},"access_counters":{"const":{"return_value_decode_count":0,"validation_access_count":0}},"validation_seal":{"const":{"status":"sealed_not_accessed","accessed":false}},"producing_git_commit":{"type":"string"},"blocker":{"type":"string"},"manifest":{"type":"object"},"payload":{"type":"object"},"output_artifacts":{"type":"object"},"structural_summary_sha256":{"pattern":"^[0-9a-f]{64}$"}}}
