{"access_counters":{"return_value_decode_count":0,"validation_access_count":0},"activation_provenance":null,"blocker":"dataset_missing","contract_artifacts":{},"dataset_artifact":{"attempted_read_count":1,"bounded_prefix_sha256":null,"complete_raw_sha256":null,"complete_read":false,"hash_count":0,"observed_byte_count":null,"read_count":0,"return_value_decode_count":0,"scan_count":0},"dataset_reference":"data/normalized/l1_yahoo_daily_v1.json","edge_claim":"none","evidence_tier":"E0","expected_dataset_sha256":"6608c0ef88f4b7edaef7523738d7a172215aa4f97c8c403adeba884d6582a4dd","hypothesis_id":"L-4","mode":"synthetic_fixture","order_id":"B8.6R11","outcome":"provisioning_blocked","producing_git_commit":"synthetic_fixture","real_provisioning_consumed":false,"schema_version":"lily_l4_b86r11_provisioning_report_v13","validation_seal":{"accessed":false,"status":"sealed_not_accessed"}}
